<?xml version="1.0" encoding="UTF-8"?>
<!DOCTYPE SiebelMessage SYSTEM "ListaCriarOrdemServico.dtd" >
<SiebelMessage IntObjectName="" MessageId="" MessageType="">
  <ListaCriarOrdemServico>
    <Dados OrigemRequisicao="">
      <ListaOrdens>
        <Ordem>
          <NumeroContaFatura>NumeroContaFatura</NumeroContaFatura>
          <NomePlano>NomePlano</NomePlano>
          <NomeCampanha>NomeCampanha</NomeCampanha>
          <NomeOferta>NomeOferta</NomeOferta>
          <PDV>PDV</PDV>
          <ListaInstancias>
            <Instancias>
              <AcaoInstancia>AcaoInstancia</AcaoInstancia>
              <DDD>DDD</DDD>
              <OiChip>OiChip</OiChip>
              <MSISDN>MSISDN</MSISDN>
              <IMEI>IMEI</IMEI>
              <OpcaoOiDados>OpcaoOiDados</OpcaoOiDados>
              <Relacionamento>Relacionamento</Relacionamento>
              <Vendedor>Vendedor</Vendedor>
              <Comentario>Comentario</Comentario>
              <ModeloAparelho>ModeloAparelho</ModeloAparelho>
              <Contato>Contato</Contato>
              <OfertaInstancia>OfertaInstancia</OfertaInstancia>
              <CampanhaInstancia>CampanhaInstancia</CampanhaInstancia>
              <FaturamentoInstancia>FaturamentoInstancia</FaturamentoInstancia>
              <ClienteInstancia>ClienteInstancia</ClienteInstancia>
              <NumPortabilidade>NumPortabilidade</NumPortabilidade>
              <NovoMSISDN>NovoMSISDN</NovoMSISDN>
              <NovoIMEI>NovoIMEI</NovoIMEI>
            </Instancias>
          </ListaInstancias>
          <ListaConvergentes>
            <Convergentes>
              <acaoConvergente>acaoConvergente</acaoConvergente>
              <tipo>tipo</tipo>
              <migraTecnologia>migraTecnologia</migraTecnologia>
              <numero>numero</numero>
              <velocidade>velocidade</velocidade>
              <velocidadeAtual>velocidadeAtual</velocidadeAtual>
              <tecnologia>tecnologia</tecnologia>
              <viabilidade>viabilidade</viabilidade>
              <nomePacote>nomePacote</nomePacote>
              <numPortabFixo>numPortabFixo</numPortabFixo>
              <operPortabFixo>operPortabFixo</operPortabFixo>
              <numSmartCard>numSmartCard</numSmartCard>
              <idFibra>idFibra</idFibra>
              <idEnderNetwin>idEnderNetwin</idEnderNetwin>
              <sistOrigem>sistOrigem</sistOrigem>
            </Convergentes>
          </ListaConvergentes>
        </Ordem>
      </ListaOrdens>
    </Dados>
  </ListaCriarOrdemServico>
</SiebelMessage>
